{
  "schema_version": "1.0",
  "source": "github",
  "repository": "R0GV3TheAlchemist/GAIA-2.0",
  "requested_ref": "main",
  "resolved_commit_sha": "0000000000000000000000000000000000000000",
  "path": ".env",
  "retrieved_at": "2026-09-13T23:46:00Z",
  "content_type": "text/plain",
  "content_hash": "sha256:bbbbbbbbbbbbbbbbbbbbbbbbbbbbbbbbbbbbbbbbbbbbbbbbbbbbbbbbbbbbbbbb",
  "source_url": "https://github.com/R0GV3TheAlchemist/GAIA-2.0/blob/0000000000000000000000000000000000000000/.env",
  "state": "denied",
  "policy_decision": {
    "outcome": "denied",
    "rule_id": "deny-sensitive-path",
    "reason": "Requested path matches a credential-bearing path policy."
  }
}
